[
 {
  "compound": "Creatine monohydrate",
  "studyDoses": [
   {
    "study": "Preen et al., Int J Sport Nutr Exerc Metab",
    "year": 2003,
    "design": "RCT, 18 men",
    "doseText": "Dose used in Preen 2003: 5 g/day maintenance after a 5-day 20 g/day loading phase",
    "doseAmount": 5,
    "doseUnit": "g/day",
    "sourceUrl": "https://pubmed.ncbi.nlm.nih.gov/12660409/",
    "doi": "https://doi.org/10.1123/ijsnem.13.1.97"
   },
   {
    "study": "Prokopidis et al., Nutr Rev",
    "year": 2023,
    "design": "Systematic review and meta-analysis of RCTs (memory)",
    "doseText": "Doses used in the trials pooled by Prokopidis 2023 ranged from about 2.2 to 20 g/day",
    "doseAmount": null,
    "doseUnit": "g/day (range 2.2-20)",
    "sourceUrl": "https://pubmed.ncbi.nlm.nih.gov/35984306/",
    "doi": "https://doi.org/10.1093/nutrit/nuac064"
   }
  ],
  "products": [
   {
    "brand": "Thorne",
    "product": "Creatine - 90 Servings",
    "price": 44,
    "currency": "USD",
    "servings": 90,
    "servingUnit": "scoop",
    "activePerServing": 5,
    "activeUnit": "g",
    "thirdPartyTesting": "NSF Certified for Sport (stated on product page)",
    "thirdPartyTestingSource": "https://www.thorne.com/products/dp/creatine",
    "priceSourceUrl": "https://www.thorne.com/products/dp/creatine",
    "note": null,
    "costPerStudyDosePerMonth": 14.67,
    "costBasisDose": "5 g/day (Preen et al. 2003)"
   },
   {
    "brand": "Momentous",
    "product": "Creatine Monohydrate, 60 servings",
    "price": 34.99,
    "currency": "USD",
    "servings": 60,
    "servingUnit": "serving",
    "activePerServing": null,
    "activeUnit": null,
    "thirdPartyTesting": "NSF Certified for Sport (stated on product page)",
    "thirdPartyTestingSource": "https://livemomentous.com/products/creatine-monohydrate-60-servings-flavors",
    "priceSourceUrl": "https://livemomentous.com/products/creatine-monohydrate-60-servings-flavors",
    "note": "Grams of creatine per serving not readable from page text (supplement facts load in a pop-up). Some variants (flavours/sizes) may be out of stock; check the page.",
    "costPerStudyDosePerMonth": null,
    "costBasisDose": null
   },
   {
    "brand": "Nutricost",
    "product": "Creatine Monohydrate Powder, 500 g",
    "price": 23.97,
    "currency": "USD",
    "servings": 100,
    "servingUnit": "5 g scoop",
    "activePerServing": 5,
    "activeUnit": "g",
    "thirdPartyTesting": "none stated",
    "thirdPartyTestingSource": null,
    "priceSourceUrl": "https://nutricost.com/products/nutricost-creatine-monohydrate-powder-500-grams",
    "note": "Servings derived: 500 g / 5 g per serving (both stated on page). Unflavored 500 G variant price. Page carries a generic 'third-party tested' statement but names no certifier.",
    "costPerStudyDosePerMonth": 7.19,
    "costBasisDose": "5 g/day (Preen et al. 2003)"
   }
  ],
  "checked": "2026-09-28"
 },
 {
  "compound": "Omega-3 (EPA+DHA)",
  "studyDoses": [
   {
    "study": "Manson et al. (VITAL), N Engl J Med",
    "year": 2019,
    "design": "RCT, 25,871 adults, 2x2 factorial",
    "doseText": "Dose used in VITAL: 1 g/day Omacor fish-oil capsule containing 840 mg of n-3 fatty acids (460 mg EPA + 380 mg DHA), per the trial's published principal-results paper (PMC7089819); the PubMed abstract itself states only 1 g/day marine n-3",
    "doseAmount": 840,
    "doseUnit": "mg/day EPA+DHA (460 mg EPA + 380 mg DHA, in a 1 g capsule)",
    "sourceUrl": "https://pubmed.ncbi.nlm.nih.gov/30415637/",
    "doi": "https://doi.org/10.1056/NEJMoa1811403",
    "additionalSourceUrl": "https://pmc.ncbi.nlm.nih.gov/articles/PMC7089819/"
   }
  ],
  "products": [
   {
    "brand": "Thorne",
    "product": "Super EPA (NSF Certified for Sport)",
    "price": 45,
    "currency": "USD",
    "servings": 90,
    "servingUnit": "gelcap",
    "activePerServing": 695,
    "activeUnit": "mg EPA+DHA (425 EPA + 270 DHA)",
    "thirdPartyTesting": "NSF Certified for Sport (stated on product page)",
    "thirdPartyTestingSource": "https://www.thorne.com/products/dp/super-epa",
    "priceSourceUrl": "https://www.thorne.com/products/dp/super-epa",
    "note": "Cost uses EPA+DHA per serving from the label (not total oil weight).",
    "costPerStudyDosePerMonth": 18.13,
    "costBasisDose": "840 mg/day EPA+DHA (Manson et al. (VITAL) 2019, 1 g Omacor capsule = 460 EPA + 380 DHA)"
   },
   {
    "brand": "Momentous",
    "product": "Omega-3",
    "price": 39.99,
    "currency": "USD",
    "servings": 30,
    "servingUnit": "serving",
    "activePerServing": 1600,
    "activeUnit": "mg EPA+DHA",
    "thirdPartyTesting": "NSF Certified for Sport, IFOS Certified (stated on product page)",
    "thirdPartyTestingSource": "https://livemomentous.com/products/omega-3",
    "priceSourceUrl": "https://livemomentous.com/products/omega-3",
    "note": "Cost uses EPA+DHA per serving from the label (not total oil weight). Some variants (flavours/sizes) may be out of stock; check the page.",
    "costPerStudyDosePerMonth": 20.99,
    "costBasisDose": "840 mg/day EPA+DHA (Manson et al. (VITAL) 2019, 1 g Omacor capsule = 460 EPA + 380 DHA)"
   },
   {
    "brand": "Transparent Labs",
    "product": "Omega 3",
    "price": 39.99,
    "currency": "USD",
    "servings": 30,
    "servingUnit": "serving",
    "activePerServing": null,
    "activeUnit": null,
    "thirdPartyTesting": "Own batch test results and COA published (self-published, no external certifier seen)",
    "thirdPartyTestingSource": "https://transparentlabs.com/products/omega-3",
    "priceSourceUrl": "https://transparentlabs.com/products/omega-3",
    "note": "EPA+DHA per serving not shown in the page text on the checked date; cost left null.",
    "costPerStudyDosePerMonth": null,
    "costBasisDose": null
   }
  ],
  "checked": "2026-09-28"
 },
 {
  "compound": "Vitamin D3",
  "studyDoses": [
   {
    "study": "Manson et al. (VITAL), N Engl J Med",
    "year": 2019,
    "design": "RCT, 25,871 adults, 2x2 factorial",
    "doseText": "Dose used in VITAL: vitamin D3 2000 IU/day",
    "doseAmount": 2000,
    "doseUnit": "IU/day",
    "sourceUrl": "https://pubmed.ncbi.nlm.nih.gov/30415629/",
    "doi": "https://doi.org/10.1056/NEJMoa1809944"
   }
  ],
  "products": [
   {
    "brand": "Thorne",
    "product": "Vitamin D-5,000 (NSF Certified for Sport)",
    "price": 20,
    "currency": "USD",
    "servings": 60,
    "servingUnit": "capsule",
    "activePerServing": 5000,
    "activeUnit": "IU",
    "thirdPartyTesting": "NSF Certified for Sport (stated on product page)",
    "thirdPartyTestingSource": "https://www.thorne.com/products/dp/vitamin-d-5000",
    "priceSourceUrl": "https://www.thorne.com/products/dp/vitamin-d-5000",
    "note": null,
    "costPerStudyDosePerMonth": 4.0,
    "costBasisDose": "2000 IU/day (Manson et al. (VITAL) 2019)"
   },
   {
    "brand": "Momentous",
    "product": "Vitamin D3 2000 IU",
    "price": 19.99,
    "currency": "USD",
    "servings": 60,
    "servingUnit": "serving",
    "activePerServing": 2000,
    "activeUnit": "IU",
    "thirdPartyTesting": "NSF Certified for Sport (stated on product page)",
    "thirdPartyTestingSource": "https://livemomentous.com/products/vitamin-d3-2000-iu",
    "priceSourceUrl": "https://livemomentous.com/products/vitamin-d3-2000-iu",
    "note": "Some variants (flavours/sizes) may be out of stock; check the page.",
    "costPerStudyDosePerMonth": 9.99,
    "costBasisDose": "2000 IU/day (Manson et al. (VITAL) 2019)"
   },
   {
    "brand": "Nutricost",
    "product": "Vegan Vitamin D3 5,000 IU",
    "price": 11.97,
    "currency": "USD",
    "servings": 60,
    "servingUnit": "capsule",
    "activePerServing": 5000,
    "activeUnit": "IU",
    "thirdPartyTesting": "none stated",
    "thirdPartyTestingSource": null,
    "priceSourceUrl": "https://nutricost.com/products/nutricost-vegan-vitamin-d3",
    "note": "Page says made in an NSF Certified facility; that is not a product certification.",
    "costPerStudyDosePerMonth": 2.39,
    "costBasisDose": "2000 IU/day (Manson et al. (VITAL) 2019)"
   }
  ],
  "checked": "2026-09-28"
 },
 {
  "compound": "Vitamin K2 (MK-7)",
  "studyDoses": [
   {
    "study": "Knapen et al., Thromb Haemost",
    "year": 2015,
    "design": "RCT, 244 postmenopausal women, 3 years",
    "doseText": "Dose used in Knapen 2015: MK-7 180 mcg/day",
    "doseAmount": 180,
    "doseUnit": "mcg/day",
    "sourceUrl": "https://pubmed.ncbi.nlm.nih.gov/25694037/",
    "doi": "https://doi.org/10.1160/TH14-08-0675"
   }
  ],
  "products": [
   {
    "brand": "Nutricost",
    "product": "Vitamin K2 MK-7 Softgels (120 ct)",
    "price": 15.97,
    "currency": "USD",
    "servings": 120,
    "servingUnit": "softgel",
    "activePerServing": 100,
    "activeUnit": "mcg",
    "thirdPartyTesting": "none stated",
    "thirdPartyTestingSource": null,
    "priceSourceUrl": "https://nutricost.com/products/nutricost-vitamin-k2-mk-7",
    "note": null,
    "costPerStudyDosePerMonth": 7.19,
    "costBasisDose": "180 mcg/day (Knapen et al. 2015)"
   },
   {
    "brand": "Jarrow Formulas",
    "product": "MK-7 180 mcg, 30 softgels",
    "price": 21.99,
    "currency": "USD",
    "servings": 30,
    "servingUnit": "softgel",
    "activePerServing": 180,
    "activeUnit": "mcg",
    "thirdPartyTesting": "none stated",
    "thirdPartyTestingSource": null,
    "priceSourceUrl": "https://www.jarrow.com/products/mk-7-180-mcg-30-softgels",
    "note": "Page cites a ConsumerLab user survey, which is not a product test.",
    "costPerStudyDosePerMonth": 21.99,
    "costBasisDose": "180 mcg/day (Knapen et al. 2015)"
   },
   {
    "brand": "Jarrow Formulas",
    "product": "MK-7 90 mcg, 60 softgels",
    "price": 22.99,
    "currency": "USD",
    "servings": 60,
    "servingUnit": "softgel",
    "activePerServing": 90,
    "activeUnit": "mcg",
    "thirdPartyTesting": "none stated",
    "thirdPartyTestingSource": null,